German Word,Bangla Pronunciation,Bangla Meaning,English Meaning,Partizip II,German sentence
extra,এক্সট্রা,অতিরিক্ত,extra,,Möchten Sie extra Käse?
flexibel,ফ্লেক্সিবেল,নমনীয়,flexible,,Unser Plan ist flexibel.
die Umwelt (Sg.),ডি উমভেল্ট,পরিবেশ,environment,,Wir schützen die Umwelt.
die Krankenkasse -n,ডি ক্রাঙ্কেনকাসে,স্বাস্থ্য বীমা,health insurance,,Welche Krankenkasse hast du?
beliebt,বেলিব্ট,জনপ্রিয়,popular,,Das Café ist sehr beliebt.
die Strecke -n,ডি শ্ট্রেকে,পথ/দূরত্ব,route/distance,,Die Strecke ist lang.
klar,ক্লার,স্পষ্ট,clear,,Ist das klar?
übertreiben (hat übertrieben),উবারট্রাইবেন,বাড়িয়ে বলা,to exaggerate,hat übertrieben,Du übertreibst wieder.
selbstverständlich,জেলপস্টফেরস্টেন্ডলিখ,স্বাভাবিকভাবে,of course/naturally,,Selbstverständlich helfe ich dir.
