German Word,Bangla Pronunciation,Bangla Meaning,English Meaning,Partizip II,German sentence
normalerweise,নরমালারভাইজে,সাধারণত,normally/usually,,Normalerweise stehe ich um sieben auf.
schwanger,শভাঙার,গর্ভবতী,pregnant,,Meine Schwester ist schwanger.
der Schwiegervater = / die Schwiegermutter =,ডার শভিগারফাটার / ডি শভিগারমুটার,শ্বশুর / শাশুড়ি,father-in-law / mother-in-law,,Mein Schwiegervater ist sehr nett.
der Haushalt -e,ডার হাউসহাল্ট,গৃহস্থালি/সংসার,household,,Wer macht den Haushalt?
die Rente -n,ডি রেন্টে,পেনশন/অবসরভাতা,pension/retirement,,Mein Vater geht bald in Rente.
