German Word,Bangla Pronunciation,Bangla Meaning,English Meaning,Partizip II,German sentence
lassen (hat gelassen),লাসেন,দেওয়া/ছেড়ে দেওয়া,to let/leave,gelassen,Lass mich bitte in Ruhe.
werfen (hat geworfen),ভেরফেন,ছুড়ে মারা/ফেলা,to throw,geworfen,Wirf den Ball zu mir.
aufpassen (hat aufgepasst),আউফপাসেন,খেয়াল রাখা/সাবধান থাকা,to pay attention/watch out,aufgepasst,Pass auf die Kinder auf.
gießen (hat gegossen),গিসেন,ঢালা/পানি দেওয়া,to pour/water,gegossen,Kannst du die Blumen gießen?
wirklich,ভিরকলিশ,সত্যিই/আসলে,really/truly,,Das ist wirklich schön.
klingeln (hat geklingelt),ক্লিঙেলন,ঘণ্টা বাজানো,to ring,geklingelt,Es hat an der Tür geklingelt.
besprechen (hat besprochen),বেশপ্রেখেন,আলোচনা করা,to discuss,besprochen,Wir müssen das Problem besprechen.
füttern (hat gefüttert),ফুটার্ন,খাওয়ানো,to feed,gefüttert,Ich muss die Katze füttern.
der Handwerker -,ডার হান্ডভের্কার,কারিগর/মিস্ত্রি,craftsman/handyman,,Der Handwerker kommt morgen.
